<?xml version="1.0"?>
<xsd:schema xmlns:xsd="http://www.w3.org/2001/XMLSchema"
	targetNamespace="https://lenz-archiv.de"
	xmlns="https://lenz-archiv.de"
	xmlns:lenz="https://lenz-archiv.de"
	elementFormDefault="qualified">

	<xsd:include schemaLocation="common.xsd"></xsd:include>

	<xsd:complexType name="actionattributes">
		<xsd:choice minOccurs="0" maxOccurs="unbounded">
			<xsd:element name="date" type="lenz:date" minOccurs="0"
				maxOccurs="unbounded" />
			<xsd:element name="location" type="lenz:ortref" minOccurs="0"
				maxOccurs="unbounded" />
			<xsd:element name="person" type="lenz:personref" minOccurs="0"
				maxOccurs="unbounded" />
		</xsd:choice>
	</xsd:complexType>

	<xsd:element name="opus">
		<xsd:complexType>
			<xsd:sequence>
				<xsd:element name="descriptions">
					<xsd:complexType>
						<xsd:sequence>
							<xsd:element name="letterDesc" minOccurs="0" maxOccurs="unbounded">
								<xsd:complexType>
									<xsd:sequence>
										<xsd:choice minOccurs="0" maxOccurs="unbounded">
											<xsd:element name="sent" type="actionattributes">
												<xsd:annotation>
													<xsd:documentation>Daten zu einem Absende-Event eines Briefes</xsd:documentation>
												</xsd:annotation>
											</xsd:element>
											<xsd:element name="received" type="actionattributes">
												<xsd:annotation>
													<xsd:documentation>Daten zu einem Empfangs-Event eines Briefes</xsd:documentation>
												</xsd:annotation>
											</xsd:element>
										</xsd:choice>
										<xsd:element name="traditions">
											<xsd:annotation>
												<xsd:documentation>Grundlagen des edierten Brieftextes, nicht sämtliche bekannten Textzeugen. Bibliographische Angaben verbleiben vorerst in traditions.xml.</xsd:documentation>
											</xsd:annotation>
											<xsd:complexType>
												<xsd:sequence>
													<xsd:element name="tradition" minOccurs="1" maxOccurs="unbounded">
														<xsd:complexType>
															<xsd:attribute name="isOriginal" type="xsd:boolean" use="required" />
															<xsd:attribute name="type" use="required">
																<xsd:annotation>
																	<xsd:documentation>manuscript: Handschrift einschließlich Abschrift; print: Druck; unknown: Editionsgrundlage noch ungeklärt.</xsd:documentation>
																</xsd:annotation>
																<xsd:simpleType>
																	<xsd:restriction base="xsd:string">
																		<xsd:enumeration value="manuscript" />
																		<xsd:enumeration value="print" />
																		<xsd:enumeration value="unknown" />
																	</xsd:restriction>
																</xsd:simpleType>
															</xsd:attribute>
														</xsd:complexType>
													</xsd:element>
												</xsd:sequence>
											</xsd:complexType>
										</xsd:element>
										<xsd:element name="isProofread" type="lenz:booleanvalue">
											<xsd:annotation>
												<xsd:documentation> Pflicht: Wurde der Text anhand der besten verfügbaren
													Quelle kritisch geprüft? </xsd:documentation>
											</xsd:annotation>
										</xsd:element>
										<xsd:element name="isDraft" type="lenz:booleanvalue">
											<xsd:annotation>
												<xsd:documentation> Pflicht: handelt es sich um einen Entwurf?</xsd:documentation>
											</xsd:annotation>
										</xsd:element>
									</xsd:sequence>
									<xsd:attribute name="letter" type="xsd:nonNegativeInteger" use="required" />
								</xsd:complexType>

							</xsd:element>
						</xsd:sequence>
					</xsd:complexType>
					<xsd:unique name="uniqueIndexLetter">
						<xsd:annotation>
							<xsd:documentation>Pflicht: Jeder Brief hat eine eindeutige ID.</xsd:documentation>
						</xsd:annotation>

						<xsd:selector xpath="lenz:letterDesc" />
						<xsd:field xpath="@letter" />
					</xsd:unique>

				</xsd:element>
			</xsd:sequence>
		</xsd:complexType>
	</xsd:element>

</xsd:schema>
